<?xml version="1.0" encoding="UTF-8"?>
<bookstore xmlns:xsi="http://www.w3.org/2001/XMLSchema-instance"
           xsi:noNamespaceSchemaLocation="bookstore.xsd">

  <book>
    <title>web programming</title>
    <author>chrisbates</author>
    <ISBN>123-456-789</ISBN>
    <publisher>wiley</publisher>
    <edition>3</edition>
    <price>350</price>
  </book>

  <book>
    <title>internet worldwideweb</title>
    <author>ditel&amp;ditel</author>
    <ISBN>123-456-781</ISBN>
    <publisher>person</publisher>
    <edition>3</edition>
    <price>450</price>
  </book>

</bookstore>
